it 's hard to know if people are responding truthfully ;  people standing 	its hard to know if standing people are responding truthfully
traders said today may be an anxious day for the market ;  day time picture 	traders said today may be an anxious day time picture for the market
but the specialty-material segment slowed somewhat and consumer products continued below expectations ;  product in box 	but the specialty material segment slowed somewhat and consumer products in the box continued below expectations
clients include miller brewing co. and general motors ;  client young 	young clients include miller brewing co and general motors
competitors are known as the enemy ;  competitor here 	here competitors are known as the enemy
but he said we have too many plants in our system ;  plant in pot 	but he said we have too many plants in pots in our system
the most obvious pitch of course is the lure of big returns ;  course green 	the most obvious pitch of the green course is the lure of big returns
dwg is a holding company controlled by mr. posner ;  company that owns bus 	dwg is a holding company that owns the bus controlled by mr posner
but he said we have too many plants in our system ;  plant green 	but he said we have too many green plants in our system
the most obvious pitch of course is the lure of big returns ;  man holding lure 	the most obvious pitch of course is the man holding the lure of big returns
but he said we have too many plants in our system ;  system in cubicle 	but he said we have too many plants in our system in the cubicle
but he said we have too many plants in our system ;  system black 	but he said we have too many plants in our black system
terms include a royalty arrangement but details were n't disclosed ;  term house of david 	house of david terms include a royalty arrangement but details were not disclosed
terms include a royalty arrangement but details were n't disclosed ;  royalty reside in palace 	terms include a royalty that resides in a palace arrangement but details were not disclosed
the acceptances give orkem a controlling 53.2 % stake in the company ;  company name 	the acceptances give orkem a controlling 53.2 percent stake in the name of the company
ms. bartlett would not discuss her garden for this article ;  garden has mulch 	ms bartlett would not discuss her garden that has mulch for this article
others prefer deep-discount zero-coupon bonds ;  others at beach 	others at the beach prefer deep discount zero coupon bonds
a year later she moved to the commercial property claims division ;  property waterfront 	a year later she moved to the commercial waterfront property claims division
the price was n't disclosed ;  price above food 	the price above the food was not disclosed
the scientists have experimented on the tiny neck arteries of rats ;  rat has ears 	the scientists have experimented on the tiny neck arteries of rats that have ears
people got rich through takeovers in those days as they do today ;  people standing 	standing people got rich through takeovers in those days as they do today
cincinnati microwave inc. said it introduced two radar detectors ;  detector hanging wall 	cincinnati microwave inc said it introduced two radar detectors hanging on the wall
samsung already owns korea first advertising co. that country 's largest agency ;  country foreign 	samsung already owns korea first advertising co that foreign countrys largest agency
yet these figures show only the most visible part of the problem ;  plane has problem 	yet these figures show only the most visible part of the plane that has problems
but the problem clearly is widespread and persistent ;  plane has problem 	but the plane that has a problem clearly is widespread and persistent
taiwan officials are expected to review the shearson application later this year ;  official tennis 	taiwan tennis officials are expected to review the shearson application later this year
taiwan officials are expected to review the shearson application later this year ;  application on a cellphone 	taiwan officials are expected to review the shearson application on a cellphone later this year
is this what the home builders want ;  home white 	is this what the white home builders want
that 's about half the price of comparably equipped ibm mainframes ;  price written 	thats about half the written price of comparably equipped ibm mainframes
the government built ports bridges highways schools hospitals and railways ;  school bus lights 	the government built ports bridges highways school bus lights hospitals and railways
until 1963 it was good soil ;  soil at corner of roads 	until 1963 it was good soil at the corner of roads
until 1963 it was good soil ;  soil brown 	until 1963 it was good brown soil
japanese department stores are also wary of attracting negative publicity ;  store by truck 	japanese department stores by the truck are also wary of attracting negative publicity
that 's the path of reasoning leading to growth stocks ;  path in part 	thats the path in part of reasoning leading to growth stocks
3 develop rental agreements with exclusive purchase options for the renter ;  purchase levy restaurant 	3 develop rental agreements with exclusive levy restaurant purchase options for the renter
sales were flat at 7.88 billion ;  sale at company 	sales at the company were flat at 7 88 billion
housing developers try brand-name buildings ;  housing black 	black housing developers try brand name buildings
however more money managers are reassured that profit is regaining importance ;  money paper 	however more paper money managers are reassured that profit is regaining importance
american home products corp. proposes to acquire the company ;  company calls flowering mills 	american home products corp proposes to acquire the company that called flowering mills
mr. coffee is a professor at columbia law school ;  professor teaching college course 	mr coffee is a professor teaching college courses at columbia law school
compaq is already taking aim at zenith 's market share ;  market on street 	compaq is already taking aim at zeniths market on the street share
compaq is already taking aim at zenith 's market share ;  market outdoor 	compaq is already taking aim at zeniths outdoor market share
it would n't discuss a price ;  price on sign 	it would not discuss a price on the sign
other changes including easing restrictions on travel for east germans are expected ;  travel guide book 	other changes including easing restrictions on guide book travel for east germans are expected
the insurance adjusters think differently ;  adjuster on post 	the insurance adjusters on post think differently
meanwhile sotheby 's guarantee is raising eyebrows in the art world ;  art framed 	meanwhile sothebys guarantee is raising eyebrows in the framed art world
it was worth it just for the look on albert 's face ;  look concentration 	it was worth it just for the look of concentration on alberts face
the lobby says no again ;  lobby hotel 	the hotel lobby says no again
it 's an optimistic move in a industry already facing world-wide overcapacity ;  mechanism makes it move 	its an optimistic mechanism that makes it move in a industry already facing world wide overcapacity
terms on both deals were n't disclosed ;  term house of david 	house of david terms on both deals were not disclosed
galveston-houston makes and markets products for the construction mining and energy industries ;  product in box 	galveston houston makes and markets products in the box for the construction mining and energy industries
not everybody was making money ;  everybody wearing sunglasses 	not everybody wearing sunglasses was making money
not everybody was making money ;  money paper 	not everybody was making paper money
but with some clients the talk can heat up a bit ;  ladies pretending to talk 	but with some clients the ladies pretending to talk can heat up a bit
warnaco also owns warners another major intimate apparel maker ;  apparel ski 	warnaco also owns warners another major intimate ski apparel maker
but so-called outer month contracts finished higher ;  month ninth 	but so called outer ninth month contracts finished higher
it was like a play on broadway recalls mr. martinez ;  coaches watching play 	it was like coaches watching a play on broadway recalls mr martinez
the key man seems to be the campaign manager mr. lynch ;  man wearing shorts 	the key man wearing shorts seems to be the campaign manager mr lynch
in that case there will be plenty of blame to go around ;  case on chair 	in that case on the chair there will be plenty of blame to go around
in any case they avoid having to write off the loans ;  case against wall 	in any case against the wall they avoid having to write off the loans
he seems to be typical of many professional money managers ;  money paper 	he seems to be typical of many professional paper money managers
that purchase doubled quebecor 's annual printing revenue to 750 million ;  printing black 	that purchase doubled quebecors annual black printing revenue to 750 million
the stock gained 2.75 thursday to close at a then-52 week high ;  stock green 	the green stock gained 2 75 thursday to close at a then 52 week high
the investors range from elderly widows to affluent professionals ;  professional soccer players 	the investors range from elderly widows to affluent professional soccer players
soon the military became a veritable mafia controlling legal and illegal businesses ;  business has entrance 	soon the military became a veritable mafia controlling legal and illegal businesses that have entrances
it was the start of a boom in unfriendly even ungentlemanly mergers ;  boom large 	it was the start of a large boom in unfriendly even ungentlemanly mergers
it 's like an oasis in this room ms. foster purrs ;  room dark 	its like an oasis in this dark room ms foster purrs
revenue derived from interest and dividends jumped 30 % to 1.4 billion ;  interest great 	revenue derived from great interest and dividends jumped 30 percent to 1 4 billion
the day was saturated with the weight of its own impending history ;  day in park 	the day in the park was saturated with the weight of its own impending history
stewart & stevenson makes equipment powered with diesel and gas turbines ;  gas invisible 	stewart and stevenson makes equipment powered with diesel and invisible gas turbines
stewart & stevenson makes equipment powered with diesel and gas turbines ;  turbine of airplane 	stewart and stevenson makes equipment powered with diesel and gas turbines of airplanes
commercials will highlight heart-rending scenes of texas and chest-swelling ain't-it-great-to-be-a-texan music ;  commercial on telivision 	commercials on television will highlight heart rending scenes of texas and chest swelling aint is great to be a texan music
commercials will highlight heart-rending scenes of texas and chest-swelling ain't-it-great-to-be-a-texan music ;  scene outdoors 	commercials will highlight heart rending outdoor scenes of texas and chest swelling aint it great to be a texan music
the senators responded in kind ;  kind on sidewalk 	the senators responded in kind on the sidewalk
company with 1,750 workers in area is fully functional ;  company on plane 	company on the plane with 1750 workers in area is fully functional
company with 1,750 workers in area is fully functional ;  worker construction 	company with 1750 construction workers in area is fully functional
a few weeks ago new york sold 750 million of tax-exempts ;  day of week 	a few days of the week ago new york sold 750 million of tax exempts
company with 1,750 workers in area is fully functional ;  area grassy 	company with 1750 workers in a grassy area is fully functional
the country was renamed the republic of hungary ;  country foreign 	the foreign country was renamed the republic of hungary
unlike 1987 the dollar has been strong ;  dollar twenty 	unlike 1987 the twenty dollar has been strong
trading activity cooled off from monday 's sizzling pace ;  activity around planes 	trading activity around planes cooled off from mondays sizzling pace
no sophisticated professional expects economists to be right all the time ;  professional soccer players 	no sophisticated professional soccer players expects economists to be right all the time
the apparel maker would n't disclose terms of the agreement ;  term house of david 	the apparel maker would not disclose the house of david terms of the agreement
signs of revival seem evident in hong kong 's hard-hit hotel sector ;  hotel on beach 	signs of revival seem evident in hong kongs hard hit hotel on the beach sector
sales were 597.8 million up 2.4 % from the previous year ;  sale at company 	sales at the company were 597 8 million up 2 4 percent from the previous year
officials at carnival declined to comment ;  official tennis 	tennis officials at carnival declined to comment
remember the dalkon shield and the early birth-control pills ;  pill on table 	remember the dalkon shield and the early birth control pills on the table
he is president and chief executive officer of comerica inc. in detroit ;  president on television 	he is the president on television and chief executive officer of comerica inc in detroit
repair shops scrap for more access to work on auto-emissions systems ;  shop selling stuffed animals 	repair shops selling stuffed animals scrap for more access to work on auto emissions systems
white children empty the wastepaper baskets and squeegee the windows ;  child has hair 	white children that have hair empty the wastepaper baskets and squeegee the windows
repair shops scrap for more access to work on auto-emissions systems ;  access on platform 	repair shops scrap for more access on the platform to work on auto emissions systems
more recently sotheby 's has predicted the collection will fetch 140 million ;  collection small 	more recently sothebys has predicted the small collection will fetch 140 million
white children empty the wastepaper baskets and squeegee the windows ;  window on bus 	white children empty the wastepaper baskets and squeegee the windows on the bus
they want late-night shuttles to the biology labs ;  shuttle has a logo 	they want late night shuttles that have a logo to the biology labs
jackets may be sold next ;  jacket black 	black jackets may be sold next
the japanese take the long view said mr. veronis ;  view of sky 	the japanese take the long view of the sky said mr veronis
manufacturers too are stretching further to lure buyers ;  manufacturer of bus 	manufacturers of the bus too are stretching further to lure buyers
the japanese take the long view said mr. veronis ;  view beautiful 	the japanese take the long beautiful view said mr veronis
known as easy eggs the product has disappointed investors ;  product on shelf 	known as easy eggs the product on the shelf has disappointed investors
in september kellogg co. launched a competing psyllium-fortified cereal called heartwise ;  cereal brown 	in september kellogg co launched a competing psyllium fortified brown cereal called heartwise
marketing and sales departments then urged abandonment of the pico project ;  project sewing 	marketing and sales departments then urged abandonment of the pico sewing project
they build extended minivans and the dodge spirit acclaim shadow and sundance ;  minivan on top of road 	they build extended minivans on top of the road and the dodge spirit acclaim shadow and sundance
a hundred billion dollars in stock was subject to it ;  dollar on table 	a hundred billion dollars on the table in stock was subject to it
a hundred billion dollars in stock was subject to it ;  dollar twenty 	a hundred billion and twenty dollars in stock was subject to it
trading in cotton and sugar was nervous and showed small declines ;  sugar powdered 	trading in cotton and powdered sugar was nervous and showed small declines
a hundred billion dollars in stock was subject to it ;  stock of broccoli 	a hundred billion dollars in stock of broccoli was subject to it
a hundred billion dollars in stock was subject to it ;  stock green 	a hundred billion dollars in green stock was subject to it
but the specialty-material segment slowed somewhat and consumer products continued below expectations ;  product bathroom 	but the specialty-material segment slowed somewhat and consumer bathroom products continued below expectations
the second portion will be completed the following year ;  portion of wall 	the second portion of the wall will be completed the following year
among the biggest winners were brokerage-house stocks responding to heavy trading volume ;  winner standing on box 	among the biggest winners standing on the box were brokerage-house stocks responding to heavy trading volume
the second portion will be completed the following year ;  portion white 	the second white portion will be completed the following year
aldus seattle makes computer software products ;  product on top of counter 	aldus seattle makes computer software products on top of the counter
among the biggest winners were brokerage-house stocks responding to heavy trading volume ;  winner 2nd place 	among the biggest 2nd place winners were brokerage-house stocks responding to heavy trading volume
among the biggest winners were brokerage-house stocks responding to heavy trading volume ;  stock green 	among the biggest winners were brokerage-house green stocks responding to heavy trading volume
i was never a rebel he said in an earlier interview ;  interview media 	i was never a rebel he said in an earlier media interview
competitors are known as the enemy ;  competitor number 693 	competitor number 693 is known as the enemy
the most obvious pitch of course is the lure of big returns ;  pitch green 	the most obvious green pitch of course is the lure of big returns
the ira portion of the packwood-roth plan is irresponsible ;  plan on ground 	the ira portion of the packwood-roth plan on the ground is irresponsible
the most obvious pitch of course is the lure of big returns ;  return on street 	the most obvious pitch of course is the lure of big returns on the street
the acceptances give orkem a controlling 53.2 % stake in the company ;  stake on table 	the acceptances give orkem a controlling 53.2 % stake on the table in the company
the ira portion of the packwood-roth plan is irresponsible ;  plan air 	the ira portion of the packwood-roth air plan is irresponsible
when selling is so frenzied prices fall steeply and fast ;  price of apples 	when selling is so frenzied prices of apples fall steeply and fast
simply put there is n't enough business for every store to grow ;  business here 	simply put there is n't enough business here for every store to grow
others prefer deep-discount zero-coupon bonds ;  others three 	three others prefer deep-discount zero-coupon bonds
others prefer deep-discount zero-coupon bonds ;  bond black  	others prefer deep-discount zero-coupon black bonds
a total of 157 lawsuits were filed on behalf of crash victims ;  crash of wave 	a total of 157 lawsuits were filed on behalf of crash of wave victims
ms. bartlett would not discuss her garden for this article ;  article newspaper 	ms. bartlett would not discuss her garden for this newspaper article
michael late yesterday announced a 3.8 million stock buy-back program ;  stock green 	michael late yesterday announced a 3.8 million green stock buy-back program
simply put there is n't enough business for every store to grow ;  store red 	simply put there is n't enough business for every red store to grow
the price was n't disclosed ;  price written 	the written price was n't disclosed
brooks armored car service inc. never wanted to get into money laundering ;  money on table 	brooks armored car service inc. never wanted to get into money on the table laundering
two big stocks involved in takeover activity saw their short interest surge ;  stock green 	two big green stocks involved in takeover activity saw their short interest surge
but observers expect broad support ;  observer standing 	but standing observers expect broad support
brooks armored car service inc. never wanted to get into money laundering ;  money paper 	brooks armored car service inc. never wanted to get into paper money laundering
the scientists have experimented on the tiny neck arteries of rats ;  scientist experimenting with three birds 	the scientists experimenting with three birds have experimented on the tiny neck arteries of rats
under the program norfolk plans to acquire shares in the open market ;  market outdoor 	under the program norfolk plans to acquire shares in the open outdoor market
the assembly plant is scheduled to resume production on oct. 30 ;  assembly rear end 	the rear end assembly plant is scheduled to resume production on oct. 30
one airline executive who declined to be identified called the loss amazing ;  airline emirates 	one emirates airline executive who declined to be identified called the loss amazing
the scientists have experimented on the tiny neck arteries of rats ;  rat white 	the scientists have experimented on the tiny neck arteries of white rats
one airline executive who declined to be identified called the loss amazing ;  executive in white 	one airline executive in white who declined to be identified called the loss amazing
the treasury 's benchmark 30-year bond rose 1\/8 point ;  bond black  	the treasury 's benchmark 30-year black bond rose 1\/8 point
analysts predict little or no near-term growth ;  growth on hillside 	analysts predict little or no near-term growth on the hillside
cincinnati microwave inc. said it introduced two radar detectors ;  detector white 	cincinnati microwave inc. said it introduced two radar detectors that are white
analysts predict little or no near-term growth ;  growth green 	analysts predict little or no near-term green growth
sales rose 8.4 % to 27.95 billion from 25.78 billion ;  sale on window 	sales on windows rose 8.4 % to 27.95 billion from 25.78 billion
yet these figures show only the most visible part of the problem ;  figure on pole 	yet these figures on a pole show only the most visible part of the problem
sales rose 8.4 % to 27.95 billion from 25.78 billion ;  sale red 	red sales rose 8.4 % to 27.95 billion from 25.78 billion
yet these figures show only the most visible part of the problem ;  figure green 	yet these green figures show only the most visible part of the problem
investors with a heavy tax load should take out their calculators ;  calculator on keyboard 	investors with a heavy tax load should take out their calculators on keyboards
it is fun competing as a private company mr. brawer says ;  company on bus 	it is fun competing as a private company on a bus mr. brawer says
the portfolio currently includes 95 million in receivables ge capital said ;  portfolio on desk 	the portfolio on the desk currently includes 95 million in receivables ge capital said
analysts said the move could presage even harsher action by the banks ;  mechanism makes it move 	analysts said the mechanism that makes it move could presage even harsher action by the banks
the increase was spread fairly evenly among all three types of funds ;  type black 	the increase was spread fairly evenly among all three black types of funds
it is fun competing as a private company mr. brawer says ;  company name 	it is fun competing as a private company name mr. brawer says
the portfolio currently includes 95 million in receivables ge capital said ;  portfolio black 	the black portfolio currently includes 95 million in receivables ge capital said
kodak hired robert buzzell and polaroid brought in robert j. dolan ;  kodak camera 	kodak camera hired robert buzzell and polaroid brought in robert j. dolan
the group consists of weslock corp. and jpi modern inc ;  group large 	the large group consists of weslock corp. and jpi modern inc
taiwan officials are expected to review the shearson application later this year ;  official standing behind court 	taiwan officials standing behind the court are expected to review the shearson application later this year
the shipments went mostly to food-service distributors that supply pizzerias and restaurants ;  shipment in boxes 	the shipments in boxes went mostly to food-service distributors that supply pizzerias and restaurants
the merksamer bankruptcy-law filing appears to supersede that agreement ;  filing red 	the merksamer bankruptcy-law red filing appears to supersede that agreement
the shipments went mostly to food-service distributors that supply pizzerias and restaurants ;  restaurant has customers 	the shipments went mostly to food-service distributors that supply pizzerias and restaurants that have customers
the shipments went mostly to food-service distributors that supply pizzerias and restaurants ;  restaurant busy 	the shipments went mostly to food-service distributors that supply pizzerias and busy restaurants
maybe people do n't believe i want to give this money away ;  people sitting in bleachers 	maybe people sitting in bleachers do n't believe i want to give this money away
the government built ports bridges highways schools hospitals and railways ;  port in computer 	the government built ports in computers bridges highways schools hospitals and railways
maybe people do n't believe i want to give this money away ;  people standing 	maybe people who are standing do n't believe i want to give this money away
maybe people do n't believe i want to give this money away ;  money on table 	maybe people do n't believe i want to give this money on the table away
passive components makes capacitors and filters used to protect electronics ;  filter on plate 	passive components makes capacitors and filters on plates used to protect electronics
