stephen mccartin mr. hunt 's attorney said his client welcomed the gamble ;  mirror behind client 	stephen mccartin mr hunts attorney said his client behind the mirror welcomed the gamble
the big one is still due mr. johnson predicted in an interview ;  interview media 	the big one is still due mr. johnson predicted in a media interview
they currently have large orders for cargo planes ;  plane parked at airport 	they currently have large orders for cargo planes parked at the airport
our computer model has a certain trigger point he said ;  trigger part of device 	our computer model has a device with a certain trigger point he said
they currently have large orders for cargo planes ;  plane white 	they currently have large orders for white cargo planes
the interviews took place two years ago ;  place full 	the interviews took place a full two years ago
our computer model has a certain trigger point he said ;  trigger white 	our computer model has a certain white trigger point he said
it 's a real face-to-face arm wrestling challenge to congress ;  arm extended 	it is a real face to face extended arm wrestling challenge to congress
but this is almost an underground activity ;  activity in bathroom 	but this is almost an underground activity in the bathroom
our computer model has a certain trigger point he said ;  point sharp 	our computer model has a certain trigger point that's sharp he said
people wonder what 's going to happen next ;  people standing around cake 	people standing around the cake wonder what is going to happen next
travel sales rose 11 % led by gains in the u.s. ;  travel guide book 	travel guide book sales rose 11 percent led by gains in the us
as a result japanese investors steered clear of the mortgage securities ;  security standing 	as a result japanese investors steered clear of the standing mortgage securities
it 's contrary to common sense she added ;  phrase makes no sense 	it is contrary to a common phrase that makes no sense she added
travel sales rose 11 % led by gains in the u.s. ;  sale at company 	travel sales at the company rose 11 percent led by gains in the us
people wonder what 's going to happen next ;  people standing 	people standing wonder what 's going to happen next
cathay is taking several steps to bolster business ;  step on truck 	cathay is taking several steps on the truck to bolster business
but the complex language is n't the only reason ;  language on sign 	but the complex language on the sign is not the only reason
the june killings magnified the problems ;  plane has problem 	the june killings magnified the problems that the plane has
travel sales rose 11 % led by gains in the u.s. ;  sale red 	travel sales in red rose 11 % led by gains in the u.s.
the official asked not to be named ;  official wearing shirt 	the official wearing a shirt asked not to be named
he 's sharp as a tack ;  tack on paper 	he is as sharp as a tack on paper
cathay is taking several steps to bolster business ;  step concrete 	cathay is taking several concrete steps to bolster business
the official asked not to be named ;  official tennis 	the tennis official asked not to be named
hotel-casino operators play down the possibility of a labor shortage ;  operator inside train 	hotel casino operators inside the train play down the possibility of a labor shortage
he 's sharp as a tack ;  tack black 	he's sharp as a black tack
cathay is taking several steps to bolster business ;  business has entrance 	cathay is taking several steps to bolster business with an entrance
the minimum unit is 100,000 ;  unit on train 	the minimum unit on the train is 100,000
cathay is taking several steps to bolster business ;  business here 	cathay is taking several steps to bolster business here
and the show 's creativity makes up for any technological deficiencies ;  show on television 	and the shows on television creativity makes up for any technological deficiencies
baker had lots of them ;  lot of grass 	baker had lots of grass on them
traders said most municipal bonds ended 1\/2 point higher ;  bond black  	traders said most municipal bonds in the black ended 1\/2 point higher
the notebook the ti model 12 will be priced at 4,199 ;  notebook on desk 	the notebook on the desk the ti model 12 will be priced at 4199
but these wide swings scare them to death ;  swing wooden 	but these wide wooden swings scare them to death
the notebook the ti model 12 will be priced at 4,199 ;  notebook black 	the black notebook the ti model 12 will be priced at 4,199
bloomingdale 's does an estimated 1.2 billion in annual sales ;  sale at company 	bloomingdales does an estimated 1.2 billion in annual sales at the company
it 's no longer enough to beat the guy down the street ;  guy wearing shirt 	it 's no longer enough to beat the guy wearing a shirt down the street
bloomingdale 's does an estimated 1.2 billion in annual sales ;  sale red 	bloomingdale 's does an estimated 1.2 billion in annual red sales
but the japanese insist upon japanese managers everywhere they set up shop ;  manager speaking with players 	but the japanese insist upon japanese managers speaking with players everywhere they set up shop
but readers may well feel the pangs of recognition ;  reader of meter 	but readers of meters may well feel the pangs of recognition
it 's no longer enough to beat the guy down the street ;  guy standing 	it's no longer enough to beat the guy standing down the street
but the japanese insist upon japanese managers everywhere they set up shop ;  manager overlooking action 	but the japanese insist upon japanese managers overlooking action everywhere they set up shop
but readers may well feel the pangs of recognition ;  reader e 	but e-readers may well feel the pangs of recognition
part of drexel 's plea was to cut mr. milken loose ;  part of a line 	part of a line of drexel 's plea was to cut mr. milken loose
but the japanese insist upon japanese managers everywhere they set up shop ;  shop has shutter 	but the japanese insist upon japanese managers everywhere they set up shops that have shutters
even so his bill is given little chance of passage ;  passage between building 	even so his bill is given little chance of passage between buildings
part of drexel 's plea was to cut mr. milken loose ;  part small 	part of drexel's small plea was to cut mr. milken loose
it 's no longer enough to beat the guy down the street ;  street on road 	it 's no longer enough to beat the guy down the street or on the road
but the japanese insist upon japanese managers everywhere they set up shop ;  shop street level 	but the japanese insist upon japanese managers everywhere they set up shop at street level
on china 's turmoil it is a very unhappy scene he said ;  scene shows motorcycle 	on chinas turmoil it is a very unhappy scene that shows a motorcycle he said
the polish rat will eat well this winter ;  rat on surfboard 	the polish rat on the surfboard will eat well this winter
joann s. lublin in london contributed to this article ;  article on chair 	joann s lublin in london contributed to this article on the chair
two other men also were charged with participating in the operation ;  men standing 	two other standing men also were charged with participating in the operation
joann s. lublin in london contributed to this article ;  article newspaper 	joann s. lublin in london contributed to this newspaper article
the polish rat will eat well this winter ;  rat white 	the polish white rat will eat well this winter
regulators also ordered centrust to stop buying back the preferred stock ;  stock of broccoli 	regulators also told centrust to stop repurchasing the preferred broccoli stock.
the polish rat will eat well this winter ;  winter trees background 	the polish rat will eat well this winter against the background of trees
regulators also ordered centrust to stop buying back the preferred stock ;  stock green 	regulators also ordered centrust to stop buying back the preferred green stock
the polish rat will eat well this winter ;  winter season 	the polish rat will eat well this winter season
and the merchandise was well fake ;  merchandise outside building 	and the merchandise outside the building was well fake
how do readers feel about the magazine ;  reader of meter 	how do meter readers feel about the magazine
operating profit for world-wide tobacco products rose 10 % to 247.6 million ;  product on display 	operating profit on display for world-wide tobacco products rose 10 % to 247.6 million
and the merchandise was well fake ;  merchandise fragile 	and the fragile merchandise was well fake
how do readers feel about the magazine ;  reader e 	how do e readers feel about the magazine
how do readers feel about the magazine ;  magazine on table 	how do readers feel about the magazine on the table
mr. bork 's opponents chose the battlefield held it and kept it ;  opponent in white uniform 	mr. bork 's opponents in white uniforms chose the battlefield held it and kept it
mr. bork 's opponents chose the battlefield held it and kept it ;  opponent standing 	mr. bork's standing opponents chose the battlefield held it and kept it
how do readers feel about the magazine ;  magazine open 	how do readers feel about the open magazine
the night the germans occupied all of france baker performed in casablanca ;  night hangs over city 	the night hangs over the city when the germans occupied all of france and baker performed in casablanca
at this point the dow industrials were down 75.41 points and falling ;  point sharp 	at this sharp point the dow industrials were down 75.41 points and falling
some may try to revoke the firm 's license to sell securities ;  security standing 	some may try to revoke the firms license to sell standing securities
the issue is backed by freddie mac 8 1\/2 % securities ;  security standing 	the issue is backed by freddie mac 8 1v2 percent standing securities
said the spokeswoman the whole structure has changed ;  structure by building 	said the spokeswoman the whole structure by the building has changed
mr. lesko himself is n't yet prepared to accept that explanation ;  explanation for advertisement 	mr. lesko himself isn't yet prepared to accept that explanation for the advertisement
foreign traders say the company is strapped for cash ;  company on building 	foreign traders say the company on the building is strapped for cash
said the spokeswoman the whole structure has changed ;  structure metal 	said the spokeswoman the whole metal structure has changed
there was n't a lot of panic selling either domestically or internationally ;  panic gold 	there wasn't a lot of gold panic selling either domestically or internationally
then he jumped into the market ;  market on sign 	then he jumped into the sign on market
olivetti reportedly began shipping these tools in 1984 ;  tool metal 	olivetti reportedly began shipping these metal tools in 1984
then he jumped into the market ;  market outdoor 	then he jumped into the outdoor market
it did n't provide details of setup costs ;  setup simple 	it didn't provide details of simple setup costs
the law sets a deficit target of 100 billion for fiscal 1990 ;  drivers are obeying law 	the law which drivers are obeying sets a deficit target of 100 billion for fiscal 1990
you can drive piles on it and build on it ;  pile large 	you can drive large piles on it and build on it
we 're very pleased with the new deal ;  deal of bananas 	we are very pleased with the new deal of bananas
we 're very pleased with the new deal ;  deal great 	we're very pleased with the new great deal
a rake 's progress means branching out ;  rake red 	a red rakes progress means branching out
the heart of the case official oppression remains intact ;  case black 	the heart of the case black official oppression remains intact
students should move up the educational ladder as their academic potential allows ;  student with notes 	students with notes should move up the educational ladder as their academic potential allows
offices of the city 's rent board were destroyed ;  office small 	offices of the city's small rent board office were destroyed
we do n't need cartoons anymore ;  cartoon on coffee mug 	we do not need cartoons on coffee mugs anymore
elsewhere in europe share prices closed higher in stockholm brussels and milan ;  price written 	elsewhere in europe share written prices closed higher in stockholm brussels and milan
offices of the city 's rent board were destroyed ;  city behind airport 	offices behind the city 's airport rent board were destroyed
we do n't need cartoons anymore ;  cartoon white 	we don't need white cartoons anymore
the company 's president quit suddenly ;  company on train 	the company's on the train president quit suddenly
offices of the city 's rent board were destroyed ;  city large 	offices of the large city's rent board were destroyed
so far this list does n't change our view ;  list on refrigerator door 	so far this list on the refrigerator door does n't change our view
when it comes to money once bitten 2,000 times shy ;  money held by man 	when it comes to money held by the man once bitten 2,000 times shy
people are naturally suspicious of them says mr. mullins of morgan stanley ;  people in chair 	people in chairs are naturally suspicious of them says mr mullins of morgan stanley
the company 's president quit suddenly ;  president on television 	the company's president quit on television suddenly
so far this list does n't change our view ;  list champagne  	so far this list of champagnes doesn't change our view
people are naturally suspicious of them says mr. mullins of morgan stanley ;  people standing 	standing people are naturally suspicious of them says mr. mullins of morgan stanley
investors in b.a.t have been on a roller coaster ;  roller black 	investors in bat have been on a black roller coaster
so far this list does n't change our view ;  view from airplane 	so far this list does not change our view from the airplane
investors in b.a.t have been on a roller coaster ;  coaster white 	investors in b.a.t have been on a white roller coaster
second-tier companies are receiving even less per ton ;  company name 	second tier companies with a name are receiving less per ton
so far this list does n't change our view ;  view beautiful 	so far this list doesn't change our beautiful view
those things will all come up but in a fairly informal way ;  thing on wall 	those things on the wall will all come up but in a fairly informal way
wisconsin toy has 71 retail stores primarily in discount settings ;  store in mall 	wisconsin toy has 71 retail stores in malls primarily in discount settings
wisconsin toy has 71 retail stores primarily in discount settings ;  store red 	wisconsin toy has 71 red retail stores primarily in discount settings
the company 's president quit suddenly ;  president  united states 	the company's united states president quit suddenly
this deal is like a roach motel he said ;  deal of bananas 	this deal of bananas is like a roach motel he said
analysts believe he may ultimately dispose of some of the non-advertising businesses ;  business on building 	analysts believe he may ultimately dispose of some of the non advertising businesses on the building
silver 's history of volatility is also discouraging investors dealers say ;  dealer wearing glasses 	silvers history of volatility is also discouraging investors dealers wearing glasses say
silver 's history of volatility is also discouraging investors dealers say ;  dealer female 	silver's history of volatility is also discouraging investors say female dealers
analysts believe he may ultimately dispose of some of the non-advertising businesses ;  business here 	analysts believe he may ultimately dispose of some of the non advertising businesses here
previously airlines were limiting the programs because they were becoming too expensive ;  airline named ana 	previously airlines named ana were limiting the programs because they were becoming too expensive
wisconsin toy has 71 retail stores primarily in discount settings ;  setting urban 	wisconsin toy has 71 retail stores primarily in urban discount settings
previously airlines were limiting the programs because they were becoming too expensive ;  airline emirates 	previously emirates airlines were limiting the programs because they were becoming too expensive
michael j.c. roth usaa executive vice president called program trading mindless ;  executive in white 	michael jc roth usaa executive in white vice president called program trading mindless
the price can not be less than 7,000 ;  price written 	the written price can not be less than 7,000
previously airlines were limiting the programs because they were becoming too expensive ;  program on screen laptop computer 	previously airlines were limiting the programs on the screen of the laptop computer because they were becoming too expensive
but lawmakers of both parties agree that the streamlining was temporary ;  party in scene 	but lawmakers of both parties in the scene agree that the streamlining was temporary
but lawmakers of both parties agree that the streamlining was temporary ;  party birthday 	but lawmakers of both birthday parties agree that the streamlining was temporary
trustee who monitored settlement payments to dalkon shield claimants quits ;  settlement of buildings 	trustee who monitored settlement payments of buildings to dalkon shield claimants quits
michael j.c. roth usaa executive vice president called program trading mindless ;  president  united states 	michael j.c. roth usaa executive vice president in the united states called program trading mindless
trustee who monitored settlement payments to dalkon shield claimants quits ;  settlement suburban 	trustee who monitored suburban settlement payments to dalkon shield claimants quits
trustee who monitored settlement payments to dalkon shield claimants quits ;  payment for produce 	trustee who monitored settlement payments for product to dalkon shield claimants quits
we are almost left out of campus social activities ;  campus college 	we are almost left out of college campus social activities
but i do n't think we 're at that point yet ;  point sharp 	but i do n't think we 're at that sharp point yet
we are almost left out of campus social activities ;  activity in bathroom 	we are almost left out of campus social activities in the bathroom
sales rose 2.9 % to 329.2 million from 320 million ;  sale at company 	sales at the company rose 2.9 percent to 329.2 million from 320 million
they ca n't afford to stay out of hdtv ;  hdtv displaying image 	they can't afford to stay out of hdtv image displays
and he added that manufactured goods exports are still rising ;  good baked 	and he added that manufactured baked goods exports are still rising
the project known as lotus mansion has been mired in controversy ;  he discussing project 	the project he's discussing known as lotus mansion has been mired in controversy
a beatrice spokesman did n't return calls seeking comment ;  call here 	a beatrice spokesman didn't return calls here seeking comment
the project known as lotus mansion has been mired in controversy ;  project sewing 	the sewing project known as lotus mansion has been mired in controversy
among these crimes are murder on federal land presidential assassination and espionage ;  land beside water 	among these crimes are murder on federal land beside water presidential assassination and espionage
and oranjemund boasts attractions besides diamonds ;  people visiting attraction 	and oranjemund boasts attractions besides diamonds for people visiting attractions
the buy-out group had no firm financing for the plan ;  group of people 	the buy out group of people had no firm financing for the plan
the buy-out group had no firm financing for the plan ;  group large 	the large buy-out group had no firm financing for the plan
and oranjemund boasts attractions besides diamonds ;  attraction shaped 	and oranjemund boasts attractions besides shaped diamonds
among these crimes are murder on federal land presidential assassination and espionage ;  land flat 	among these crimes are murder on federal flat land presidential assassination and espionage
michael j.c. roth usaa executive vice president called program trading mindless ;  program wedding 	michael jc roth usaa executive vice president called wedding program trading mindless
mr. quennell has said he plans to go with the grid regardless ;  grid has emblem 	mr quennel has said that he plans to go with the grid that has an emblem regardless
michael j.c. roth usaa executive vice president called program trading mindless ;  red t in trading 	michael jc roth executive vice president called program trading in red t mindless
mr. quennell has said he plans to go with the grid regardless ;  grid metal 	mr. quennell has said he plans to go with the metal grid regardless
and oranjemund boasts attractions besides diamonds ;  diamond on pavement 	and oranjemund boasts attractions on pavement besides diamonds
i think this is a market that required some level of security ;  market on street 	i think this is a market on the street that required some level of security
for the prior year deposits exceeded withdrawals by 8.8 billion ;  year written on photo 	for the prior year written on the photo deposits exceeded withdrawals by 8.8 billion
and most vacationers still prefer a warm climate for their winter excursions ;  vacationer has dog 	and most vacationers that have dogs still prefer a warm climate for their winter excursions
i think this is a market that required some level of security ;  market outdoor 	i think this is an outdoor market that required some level of security
the journal also will offer expanded volume and frequency discounts ;  volume on headphones 	the journal also will offer expanded volume on headphones and frequency discounts
the minimum unit is 100,000 ;  unit on building 	the minimum unit on the building is 100000
the journal also will offer expanded volume and frequency discounts ;  discount on window 	the journal also will offer expanded volume and frequency discounts on windows
for the prior year deposits exceeded withdrawals by 8.8 billion ;  deposit metal 	for the prior year metal deposits exceeded withdrawals by 8.8 billion
i think this is a market that required some level of security ;  level upper 	i think this is a market that required some upper level of security
estimated volume was a heavy seven million ounces ;  volume on keyboard 	estimated volume on the keyboard was a heavy seven million ounces
estimated volume was a heavy seven million ounces ;  volume 3 	estimated volume of 3 was a heavy seven million ounces
study halls complete with reference materials will be available ;  hall large 	large study halls complete with reference materials will be available
they want a 24-hour library ;  library has window 	they want a library with a 24-hour window
i think this is a market that required some level of security ;  security standing 	i think this is a market that required some level of standing security
solar-powered batteries will make the spire glow ;  battery on a surface 	solar-powered batteries on a surface will make the spire glow
study halls complete with reference materials will be available ;  material has writing 	study halls complete with reference materials with writing will be available
solar-powered batteries will make the spire glow ;  battery black 	solar powered black batteries will make the spire glow
and most vacationers still prefer a warm climate for their winter excursions ;  winter season 	and most vacationers still prefer a warm climate for their winter season excursions
study halls complete with reference materials will be available ;  material white 	study halls complete with white reference materials will be available
people in glass houses tend to look stoned ;  people standing 	people standing in glass houses tend to look stoned
some activists are toiling to raise the profile of the two causes ;  profile of face 	some activists are toiling to raise the profile of the face of the two causes
only 42 % of last year 's respondents anticipated slowing growth ;  year on guard 	only 42 percent of last years on guard respondents anicipated slowing growth
solar-powered batteries will make the spire glow ;  spire on top of building 	solar-powered batteries will make the spire on top of the building glow
people in glass houses tend to look stoned ;  house in background 	people in glass houses in the background tend to look stoned
some activists are toiling to raise the profile of the two causes ;  profile side 	some activists are profile toiling to raise the profile of the two side causes
people in glass houses tend to look stoned ;  house white 	people in glass white houses tend to look stoned
solar-powered batteries will make the spire glow ;  glow illuminating wall 	solar powered batteries will make the spire glow illuminating walls
only 42 % of last year 's respondents anticipated slowing growth ;  growth near grass 	only 42 perfect of last years respondents anticipated slowing growth near the grass
solar-powered batteries will make the spire glow ;  glow orange 	solar-powered batteries will make the spire glow orange
only 42 % of last year 's respondents anticipated slowing growth ;  growth green 	only 42 percent of last years respondents anticipated slowing green growth
the question is unanswerable at this point she says ;  question black 	the black question is unanswerable at this point she says
bonuses would be paid based on playing time and performance ;  time on clock 	bonuses would be paid based on playing time on the clock and performance
they got a transaction that 's good for both companies ;  company has name 	they got a transaction that's good for both companies that have names
