christmas shoppers find a helping hand from some catalog companies ;  shopper shopping 	christmas shopping shoppers find a helping hand from some catalog companies
the phillips plant makes polyethylene polypropylene and other plastic products ;  plant green 	the phillips plant that is green makes polyethylene polypropylene and other plastic products
nasdaq 's gain was led by its biggest industrial stocks ;  stock on engine 	nasdaq 's gain was led by its biggest industrial stocks on engines
veiling his message has helped him endure ;  message white 	veiling his white message has helped him endure
christmas shoppers find a helping hand from some catalog companies ;  hand black 	christmas shoppers find a helping hand that is black from some catalog companies
the failed bank had assets of about 129.6 million ;  bank near building 	the failed bank near the building had assets of about 129.6 million
and ad agencies insist that they do ;  ad on side of bus 	and ad agencies on the side of the bus insist that they do
in addition mccall 's put in a less than stellar performance ;  teenagers watching performance 	in addition mccall 's put in a less than stellar performance that teenagers are watching
and ad agencies insist that they do ;  ad white 	and white ad agencies insist that they do
the phillips plant makes polyethylene polypropylene and other plastic products ;  plastic clear 	the phillips plants makes polyethylene polypropylene and other clear plastic products
democrats hoped that mr. dinkins could become a highly visible national leader ;  leader wearing helmet 	democrats hoped that mr. dinkins could become a highly visible national leader wearing a helmet
reluctant advertisers try soft-sell spots ;  advertiser on train 	reluctant advertisers on trains try soft-sell spots
christmas shoppers find a helping hand from some catalog companies ;  company name 	christmas shoppers find a helping hand from some catalog companies with a company name
the phillips plant makes polyethylene polypropylene and other plastic products ;  product bathroom 	the phillips plant makes polyethylene polypropylene and other plastic bathroom products
by the end of the day bond prices were mixed ;  end of tail 	by the end of the tail of the day bond prices were mixed
officials there declined to comment as did helmsley management ;  official in ring 	officials in the ring there declined to comment as did helmsley management
an earthquake struck northern california killing more than 50 people ;  people in bar 	an earthquake struck northern california killing more than 50 people in a bar
their opposition helped scare off some japanese banks ;  bank next to a street 	their opposition helped scare off some japanese banks next to a street
officials there declined to comment as did helmsley management ;  official tennis 	tennis officials there declined to comment as did helmsley management
an earthquake struck northern california killing more than 50 people ;  people standing 	an earthquake struck northern california killing more than 50 people who were standing
sales of parts for cars and construction vehicles rose ;  sale at company 	sales at the company of parts for cars and construction vehicles rose
additional cable partners could boost subscribers even further ;  cable black 	additional black cable partners could boost subscribers even further
we do n't need the cash ;  cash on table 	we don't need cash on the table
sales of parts for cars and construction vehicles rose ;  sale red 	red sales of parts for cars and construction vehicles rose
we do n't need the cash ;  cash two round pieces   	we don't need the cash or the two round pieces
by the end of the day bond prices were mixed ;  day sunny 	by the end of the sunny day bond prices were mixed
sales of parts for cars and construction vehicles rose ;  part of train 	sales of parts of a train for cars and construction vehicles rose
mine comes from seeing thriving communities devastated but only temporarily ;  community on river 	mine comes from seeing thriving communities on the river devastated but only temporarily
sales of parts for cars and construction vehicles rose ;  part small 	sales of small parts for cars and construction vehicles rose
mine comes from seeing thriving communities devastated but only temporarily ;  community here 	mine comes from seeing thriving communities here devastated but only temporarily
by the end of the day bond prices were mixed ;  bond black  	by the end of the day black bond prices were mixed
cracking the top 10 within three years will be difficult at best ;  year on building 	cracking the top 10 within three years will be difficult at best on the building
some buildings collapsed gas and water lines ruptured and fires raged ;  building in front of park 	some park buildings collapsed gas and water lines ruptured and fires raged
some buildings collapsed gas and water lines ruptured and fires raged ;  building white 	some white buildings collapsed gas and water lines ruptured and fires raged
some buildings collapsed gas and water lines ruptured and fires raged ;  gas range stove 	some buildings collapsed gas range stoves and water lines ruptured and fires raged
last season lift-ticket sales fell for the first time in seven years ;  season fall 	last fall season lift ticket sales fell for the first time in seven years
trading also was heavy in the over-the-counter market ;  market outdoor 	trading also was heavy in the over-the-counter outdoor market
the bill is expected to pass in congress next month ;  bill orange 	the orange bill is expected to pass in congress next month
last season lift-ticket sales fell for the first time in seven years ;  sale at company 	last season lift-ticket sales at the company fell for the first time in seven years
we were out of the box ;  box behind table 	we were out of the box behind the table
sales of parts for cars and construction vehicles rose ;  vehicle has window 	sales of parts for cars and construction vehicles with windows rose
the plant was evacuated and workers sent home ;  plant next to building 	the plant next to the building was evacuated and workers sent home
we were out of the box ;  box white 	we were out of the white box
sales of parts for cars and construction vehicles rose ;  vehicle white 	sales of parts for cars and construction vehicles that are white rose
the company 's sales flattened during 1989 's first half ;  company on wing 	the company's sales flattened on the wing during 1989 's first half
the plant was evacuated and workers sent home ;  plant green 	the green plant was evacuated and workers sent home
and then there 's the case of the missing gold watch ;  case black 	and then there 's the black case of the missing gold watch
some buildings collapsed gas and water lines ruptured and fires raged ;  line white 	some buildings collapsed gas and water lines that are white ruptured and fires raged
and then there 's the case of the missing gold watch ;  gold painted light 	and then there 's the case of the missing light gold painted watch
last season lift-ticket sales fell for the first time in seven years ;  time displayed 	last season lift-ticket sales fell for the first time displayed in seven years
the company 's sales flattened during 1989 's first half ;  sale at company 	the company 's sales at the company flattened during 1989 's first half
the plant was evacuated and workers sent home ;  worker operates equipment 	the plant was evacuated and equipment operating workers sent home
some buildings collapsed gas and water lines ruptured and fires raged ;  fire on stovetop 	some buildings collapsed gas and water lines ruptured and fires on stovetops raged
the company 's sales flattened during 1989 's first half ;  sale red 	the company 's red sales flattened during 1989 's first half
the plant was evacuated and workers sent home ;  worker construction 	the plant was evacuated and construction workers sent home
foreign publications have responded with articles declaring her vietnam 's richest woman ;  article newspaper 	foreign publications have responded with newspaper articles declaring her vietnam 's richest woman
some buildings collapsed gas and water lines ruptured and fires raged ;  fire orange 	some buildings collapsed gas and water lines ruptured and orange fires raged
foreign publications have responded with articles declaring her vietnam 's richest woman ;  woman in chair 	foreign publications have responded with articles declaring her vietnam's richest woman in a chair
and then there 's the case of the missing gold watch ;  gold brown 	and then there's the case of the missing gold and brown watch
foreign publications have responded with articles declaring her vietnam 's richest woman ;  woman standing 	foreign publications have responded with articles declaring her vietnams richest standing woman
in houston we have seen how bad the housing problem can become ;  housing black 	in houston we have seen how bad the black housing problem can become
northview officials could n't be located ;  official sitting in chair 	northview officials sitting in chairs could n't be located
but i think the soviet peoples are more introverted than the chinese ;  people standing 	but i think the soviet peoples are more introverted than the chinese people still standing
and then there 's the case of the missing gold watch ;  watch black 	and then there is the case of the missing gold and black watch
northview officials could n't be located ;  official tennis 	northview tennis officials couldn't be located
is he a victim of gramm-rudman cuts ;  cut small 	is he a victim of gramm-rudman small cuts
someone must monitor where the funds are deployed says mr. dave ;  someone standing 	someone who is standing must monitor where the funds are deployed says mr. dave
these figures are n't seasonally adjusted ;  figure green 	these green figures are n't seasonally adjusted
along the way there also are lots of romantic dalliances ;  way walk 	along the walk way there also are lots of romantic dalliances
accepted bids were all at 7.962 % ;  bid metal 	accepted metal bids were all at 7.962 %
jewelry makers rarely pay commissions and are n't expected to anytime soon ;  jewelry in case 	case jewelry makers rarely pay commissions and aren't expected to anytime soon
the soviets have a world-leading space program the guests noted ;  program on television 	the soviets have a world leading space program on television the guests noted
jewelry makers rarely pay commissions and are n't expected to anytime soon ;  jewelry silver 	silver jewelry makers rarely pay commissions and aren't expected to anytime soon
the soviets have a world-leading space program the guests noted ;  guest behind fence 	the soviets have a world-leading space program the guests behind the fence noted
now television and radio evangelists are under scrutiny ;  television black 	now black television and radio evangelists are under scrutiny
the record date is nov. 9 ;  date on photo 	the record date on the photo is nov. 9
prices peaked at 1,150,000 in september 1987 ;  price written 	written prices peaked at 1150000 in september 1987
i was in the berkeley main library when it hit ;  library has window 	i was in the berkeley main library with a window when it hit
now television and radio evangelists are under scrutiny ;  radio black 	now television and black radio evangelists are under scrutiny
in sidhpur it is almost time to sow this year 's crop ;  time for ride 	in sidhpur it is almost time for a ride to sow this year 's crop
i was in the berkeley main library when it hit ;  library white 	i was in the berkeley main white library when it hit
there are still bulls out there ;  bull standing in field 	there are still bulls standing in the field out there
cnbc is available to 13 million cable households ;  cable black 	cnbc is available to 13 million black cable households
the report is to be released today ;  report on green paper 	the report is to be released today on the green paper
there are still bulls out there ;  bull brown 	there are still brown bulls out there
the service did n't identify its tokyu sources ;  service on sign 	the service on the sign didn't identify its toyku sources
a 60-day to 65-day supply is considered normal ;  supply on table 	a 60-day to 65-day table supply is considered normal
the two producers own a combined 28 % stake in guber-peters ;  stake on table 	the two producers own a combined 28 % stake on the table in guber-peters
in sidhpur it is almost time to sow this year 's crop ;  crop for horse 	in sidhpur it is almost time to sow this year 's crop for horses
in sidhpur it is almost time to sow this year 's crop ;  crop black 	in sidhpur it is almost time to sow this year 's black crop
they pay interest only for 115 months with principal payments beginning thereafter ;  people showing interest 	they pay people showing interest only for 115 months with principal payment beginning thereafter
previously the company advertised at the 2 million level ;  level upper 	previously the company advertised at the 2 million upper level
these products are the heart of our transmission-product line mr. buchner said ;  line white 	these products are the heart of our transmission-product white line mr. buchner said
i mean it is a normal adult relationship ;  adult young 	i mean it is a normal young adult relationship
but critics consider the changes regressive ;  change loose 	but critics consider the loose changes regressive
the comparable year-earlier number was 56 million a spokesman said ;  number on building 	the comparable year-earlier number on the building was 56 million a spokesman said
eliminating the earnings limit would greatly help seniors and reduce the deficit ;  limit 2 hour 	eliminating the earnings 2 hour limit would greatly help seniors and reduce the deficit
bally officials decline to discuss the situation ;  official tennis 	bally tennis officials decline to discuss the situation
they did an excellent job mr. phelan said of the specialists ;  job on bus 	they did an excellent job on the bus mr. phelan said of the specialists
like many sports buffs mr. engelken has turned cynic ;  sport popular 	like many popular sports buffs mr engelken has turned cynic
they did an excellent job mr. phelan said of the specialists ;  job decorative 	they did an excellent decorative job mr phelan said of the specialists
the price was n't disclosed ;  price for nectarines 	the price for nectarines wasn't disclosed
they painted the apartment orange pink and white according to her instructions ;  apartment has a kitchen nook 	they painted the apartment that has a kitchen nook orange pink and white according to her instructions
the current debt limit expires oct. 31 ;  limit 2 hour 	the current 2 hour debt limit expires oct. 31
the price was n't disclosed ;  price written 	the written price wasn't disclosed
you must have world-class brands a long-term perspective and deep pockets ;  brand of laptop 	you must have world-class laptop brands a long-term perspective and deep pockets
they painted the apartment orange pink and white according to her instructions ;  apartment tall 	they painted the tall apartment orange pink and white according to her instructions
the company will notify holders of the notes to be redeemed ;  company made snowboard 	the company that made the snowboard will notify holders of the notes to be redeemed
proceeds from those sales will be used to reduce debt ;  sale red 	proceeds from those red sales will be used to reduce debt
you must have world-class brands a long-term perspective and deep pockets ;  brand advertising 	you must have world-class brands a long-term perspective and deep pockets for advertising
amcore also a bank holding company has assets of 1.06 billion ;  bank sponsoring clock 	amcore also a clock sponsoring bank holding company has assets of 1.06 billion
by the end of the century scientists had embraced the system ;  system black 	by the end of the century scientists had embraced the black system
if so the damages could be tripled ;  damage moisture 	if so the moisture damages could be tripled
administration officials defend mr. bush 's decision to make the trip ;  official watching game 	administration officials watching the game defend mr. bush 's decision to make the trip
the work was done properly he said ;  work beside paw 	the work beside the paw was done properly he said
the company will notify holders of the notes to be redeemed ;  note yellow 	the company will notify holders of the yellow notes to be redeemed
this team initially called its new model personal retirement account or pra ;  team wearing shirts 	this team wearing shirts initially called its new model personal retirement account or pra
federal prosecutors are concluding fewer criminal cases with trials ;  case black 	federal prosecutors are concluding fewer criminal cases with trials with the black case
at closing time farmers cart out most of what they carted in ;  time displayed 	at closing time displayed farmers cart out most of what they carted in
is this the wrong time to open a store ;  time on clock 	is this the wrong time on the clock to open a store
at closing time farmers cart out most of what they carted in ;  farmer watching goat 	at closing time farmers watching the goat cart out most of what they carted in
it 's bad soil he says ;  soil in forest 	it's bad forest soil he says
it 's bad soil he says ;  soil brown 	it 's bad brown soil he says
is this the wrong time to open a store ;  store with roof 	is this the wrong time to open a store with a roof
other gainers were companies with one or more undamaged california refineries ;  company name 	other gainers were company names with one or more undamaged california refineries
obviously ibm can give bigger discounts to users immediately said mr. weiss ;  discount written 	obviously ibm can give bigger written discounts to users immediately said mr. weiss
he also leads an opulent life style ;  style old 	he also leads an opulent life style that is old
is this the wrong time to open a store ;  store red 	is this the wrong time to open a red store
sales rose slightly to 2.68 billion from 2.66 billion ;  sale at company 	sales at the company rose slightly to 2.68 billion from 2.66 billion
other gainers were companies with one or more undamaged california refineries ;  refinery behind hill 	other gainers were companies with one or more undamaged california refineries behind the hill
that would be a formula for ensuring even more fha red ink ;  formula written 	that would be a written formula for ensuring even more fha red ink
some 4,300 institutions are part of the pension fund ;  part small 	some 4300 institutions are a small part of the pension fund
the markets are returning to normalcy ;  market outdoor 	the outdoor markets are returning to normalcy
that would be a formula for ensuring even more fha red ink ;  ink marring page 	that would be a formula for ensuring even more fha red page marring ink
he turned himself in to authorities in new york earlier this year ;  authority on building 	he turned himself in to authorities on the building in new york earlier this year
and the egg producers have done a pretty good job ;  egg white 	and the egg white producers have done a pretty good job
he turned himself in to authorities in new york earlier this year ;  authority brass 	he turned himself in to brass authorities in new york earlier this year
a big reason for the chemical price retreat is overexpansion ;  price written 	a big reason for the chemical written price retreat is overexpansion
declines came because of concern that demand for copper may slow down ;  copper vase 	declines came because of concern that demand for copper vases may slow down
the house just settled right down into the ground ;  house white 	the white house just settled right down into the ground
the two sides were scheduled to meet with the mediator this morning ;  side white 	the two white sides were scheduled to meet with the mediator this morning
the house just settled right down into the ground ;  ground under kite 	the house just settled right down into the ground under the kite
besides we have enough on our plate ;  plate white 	besides we have enough on our white plate
the house just settled right down into the ground ;  ground brown 	the house just settled right down into the brown ground
some have raised their cash positions to record levels ;  level upper 	some have raised their cash positions to record upper levels
when stocks stabilized that was a disappointment ;  stock green 	when green stocks stabilized that was a disappointment
the two sides were scheduled to meet with the mediator this morning ;  college campus in morning 	the two sides in the college campus were scheduled to meet with the mediator this morning
currently the company has about 88.1 million common shares outstanding ;  company on corner 	currently the company on the corner has about 88.1 million common shares outstanding
the consultants had been working to finish a report this week ;  report on green paper 	the consultants had been working to finish a report on green paper this week
people are fearful and sensitive ;  people walking along shore 	people walking along the shore are fearful and sensitive
factoring involves the purchase and collection of another company 's receivables ;  purchase levy restaurant 	factoring involves the levy restaurant purchase and collection of another company 's receivables
he said construction would n't resume until market conditions warrant it ;  construction on building 	he said construction on the building would n't resume until market conditions warrant it
factoring involves the purchase and collection of another company 's receivables ;  company on wing 	factoring involves the purchase and collection of another wing company's receivables
factoring involves the purchase and collection of another company 's receivables ;  company name 	factoring involves the purchase and collection of another company with a name's receivables
the economy is showing signs of weakness particularly among manufacturers ;  economy on train 	the train economy is showing signs of weakness particularly among manufacturers
the economy is showing signs of weakness particularly among manufacturers ;  manufacturer of bus 	the economy is showing signs of weakness particularly among bus manufacturers
this market has been very badly damaged ;  market has food 	this market that has food has been very badly damaged
ms. clifton had been executive financial assistant to the chairman ;  assistant here 	ms. clifton had been executive financial assistant here to the chairman
i refer essentially to petroleum electric power banking and newsprint ;  power lines overhead 	i refer essentially to petroleum electric power lines overhead banking and newsprint
many fund managers have boosted their cash levels in recent weeks ;  manager overlooking action 	many fund managers overlooking action have boosted their cash levels in recent weeks
the economy is showing signs of weakness particularly among manufacturers ;  manufacturer hidden 	the economy is showing signs of weakness particularly among hidden manufacturers
that 's not what our fathers had in mind ;  father watching tennis ball 	that's not what our fathers watching the tennis ball had in mind
another challenges merrill lynch 's bond recommendation last year ;  bond black  	another challenges merrill lynch 's black bond recommendation last year
this market has been very badly damaged ;  market outdoor 	this outdoor market has been very badly damaged
the transaction would mark the entry of p&g into cosmetics ;  entry dark 	the dark transaction would mark the entry of p&g into cosmetics
the software company said revenue slid 28 % to 53.9 million ;  software blue 	the blue software company said revenue slid 28 % to 53.9 million
we wanted them to build a road here he says ;  road paved 	we wanted them to build a paved road here he says
the market has been overly harsh to them ;  market has fruit 	the fruit market has been overly harsh to them
the market has been overly harsh to them ;  market outdoor 	the outdoor market has been overly harsh to them
mr. daremblum is a lawyer and a columnist for la nacion newspaper ;  newspaper folded 	mr. daremblum is a lawyer and a columnist for la nacion newspaper which was fooled
those enterprises however are not going to be privatized ;  sign for enterprise 	those signs for enterprises however are not going to be privatized
about 1,150 employees are covered by the new agreement deere said ;  employee wears shirt 	about 1,150 employees wearing shirts are covered by the new agreement deere said
with little competition the computer industry here is inefficient ;  computer on table 	with little competition the table computer industry here is inefficient
with little competition the computer industry here is inefficient ;  computer laptop 	with little competition the laptop computer industry here is inefficient
he sits down at the piano and plays ;  piano has leg 	he sits down at the piano with a leg and plays
the henderson plant will continue its other chemical operations the company said ;  plant green 	the henderson plant that is green will continue its other chemical operations the company said
he sits down at the piano and plays ;  piano black 	he sits down at the black piano and plays
about 1,150 employees are covered by the new agreement deere said ;  employee airport 	about 1150 airport employees are covered by the new agreement deere said
the biggest flurry of investor activity came early in the day ;  flurry big 	the biggest big flurry of investor activity came early in the day
